{
  "id": "aqm-landscape",
  "brief_id": "aqm-brief",
  "time_box": "2 h for the original canvass; +40 min re-canvass on 2026-10-23 for C2-C6",
  "lessons_read": [
    "memory/LESSONS.md#protocol",
    "memory/LESSONS.md#physical-hardware",
    "memory/LEDGER.md (no prior air-quality project)"
  ],
  "not_checked": [
    "commercial monitors above 150 USD (over cost_unit ceiling)",
    "LoRa / non-Wi-Fi radios (no gateway in the home)"
  ],
  "search_log": [
    {
      "capability_id": "C1",
      "source_class": "physical_supplier",
      "query": "PM2.5 laser sensor module",
      "tool": "supplier_catalogs",
      "at": "2026-10-23T12:00:00Z",
      "results_count": 14,
      "kept": [
        "cand-pm"
      ]
    },
    {
      "capability_id": "C1",
      "source_class": "open_source",
      "query": "esphome pm2.5 sensor component",
      "tool": "web_search",
      "at": "2026-10-23T12:05:00Z",
      "results_count": 9,
      "kept": [
        "cand-esphome"
      ]
    },
    {
      "capability_id": "C1",
      "source_class": "commercial_cots",
      "query": "indoor air quality monitor app pm2.5 co2",
      "tool": "web_search",
      "at": "2026-10-23T12:10:00Z",
      "results_count": 22,
      "kept": [
        "cand-consumer"
      ]
    },
    {
      "capability_id": "C1",
      "source_class": "community_issue_tracker",
      "query": "pm2.5 sensor drift fan dust issue",
      "tool": "repo_search",
      "at": "2026-10-23T12:20:00Z",
      "results_count": 31
    },
    {
      "capability_id": "C1",
      "source_class": "academic_patent_standard",
      "query": "low-cost PM2.5 sensor evaluation accuracy",
      "tool": "web_search",
      "at": "2026-10-23T12:25:00Z",
      "results_count": 12
    },
    {
      "capability_id": "C1",
      "source_class": "internal_prior",
      "query": "air quality",
      "tool": "memory",
      "at": "2026-10-23T12:00:00Z",
      "results_count": 0
    },
    {
      "capability_id": "C2",
      "source_class": "physical_supplier",
      "query": "NDIR CO2 sensor module i2c",
      "tool": "supplier_catalogs",
      "at": "2026-10-23T12:30:00Z",
      "results_count": 11,
      "kept": [
        "cand-co2"
      ]
    },
    {
      "capability_id": "C2",
      "source_class": "open_source",
      "query": "esphome co2 ndir component",
      "tool": "web_search",
      "at": "2026-10-23T12:32:00Z",
      "results_count": 7,
      "kept": [
        "cand-esphome"
      ]
    },
    {
      "capability_id": "C2",
      "source_class": "community_issue_tracker",
      "query": "ndir co2 sensor calibration drift",
      "tool": "repo_search",
      "at": "2026-10-23T12:35:00Z",
      "results_count": 18
    },
    {
      "capability_id": "C2",
      "source_class": "academic_patent_standard",
      "query": "NDIR CO2 sensor automatic baseline calibration",
      "tool": "web_search",
      "at": "2026-10-23T12:38:00Z",
      "results_count": 9
    },
    {
      "capability_id": "C2",
      "source_class": "commercial_cots",
      "query": "co2 monitor app notifications",
      "tool": "web_search",
      "at": "2026-10-23T12:40:00Z",
      "results_count": 16,
      "kept": [
        "cand-consumer"
      ]
    },
    {
      "capability_id": "C3",
      "source_class": "open_source",
      "query": "home automation platform mobile notifications local",
      "tool": "web_search",
      "at": "2026-10-23T13:00:00Z",
      "results_count": 10,
      "kept": [
        "cand-ha"
      ]
    },
    {
      "capability_id": "C3",
      "source_class": "commercial_cots",
      "query": "air quality monitor push notification threshold",
      "tool": "web_search",
      "at": "2026-10-23T13:05:00Z",
      "results_count": 14,
      "kept": [
        "cand-consumer"
      ]
    },
    {
      "capability_id": "C3",
      "source_class": "community_issue_tracker",
      "query": "companion app notification delay issue",
      "tool": "repo_search",
      "at": "2026-10-23T13:10:00Z",
      "results_count": 25
    },
    {
      "capability_id": "C3",
      "source_class": "adjacent_domain",
      "query": "self-hosted push notification service",
      "tool": "web_search",
      "at": "2026-10-23T13:15:00Z",
      "results_count": 8
    },
    {
      "capability_id": "C3",
      "source_class": "internal_prior",
      "query": "notification",
      "tool": "memory",
      "at": "2026-10-23T13:00:00Z",
      "results_count": 0
    },
    {
      "capability_id": "C4",
      "source_class": "open_source",
      "query": "home automation history recorder long term statistics",
      "tool": "web_search",
      "at": "2026-10-23T13:30:00Z",
      "results_count": 9,
      "kept": [
        "cand-ha"
      ]
    },
    {
      "capability_id": "C4",
      "source_class": "commercial_cots",
      "query": "air quality app 30 day history subscription",
      "tool": "web_search",
      "at": "2026-10-23T13:35:00Z",
      "results_count": 12,
      "kept": [
        "cand-consumer"
      ]
    },
    {
      "capability_id": "C4",
      "source_class": "community_issue_tracker",
      "query": "recorder database growth sd card wear",
      "tool": "repo_search",
      "at": "2026-10-23T13:40:00Z",
      "results_count": 20
    },
    {
      "capability_id": "C4",
      "source_class": "adjacent_domain",
      "query": "time series database small footprint",
      "tool": "web_search",
      "at": "2026-10-23T13:45:00Z",
      "results_count": 15
    },
    {
      "capability_id": "C4",
      "source_class": "internal_prior",
      "query": "history dashboard",
      "tool": "memory",
      "at": "2026-10-23T13:30:00Z",
      "results_count": 0
    },
    {
      "capability_id": "C5",
      "source_class": "community_issue_tracker",
      "query": "esp32 sensor wifi reconnect watchdog abandoned",
      "tool": "repo_search",
      "at": "2026-10-23T14:00:00Z",
      "results_count": 40
    },
    {
      "capability_id": "C5",
      "source_class": "open_source",
      "query": "esphome ota watchdog reboot on wifi loss",
      "tool": "web_search",
      "at": "2026-10-23T14:05:00Z",
      "results_count": 6,
      "kept": [
        "cand-esphome"
      ]
    },
    {
      "capability_id": "C5",
      "source_class": "physical_supplier",
      "query": "sensor enclosure vented abs",
      "tool": "supplier_catalogs",
      "at": "2026-10-23T14:10:00Z",
      "results_count": 30
    },
    {
      "capability_id": "C5",
      "source_class": "commercial_cots",
      "query": "air quality monitor reliability review one year",
      "tool": "web_search",
      "at": "2026-10-23T14:15:00Z",
      "results_count": 11
    },
    {
      "capability_id": "C5",
      "source_class": "academic_patent_standard",
      "query": "low-cost sensor network uptime field study",
      "tool": "web_search",
      "at": "2026-10-23T14:20:00Z",
      "results_count": 7
    },
    {
      "capability_id": "C6",
      "source_class": "open_source",
      "query": "home automation monthly report email summary",
      "tool": "web_search",
      "at": "2026-10-23T14:30:00Z",
      "results_count": 5
    },
    {
      "capability_id": "C6",
      "source_class": "commercial_cots",
      "query": "air quality monthly report email app",
      "tool": "web_search",
      "at": "2026-10-23T14:33:00Z",
      "results_count": 9,
      "kept": [
        "cand-consumer"
      ]
    },
    {
      "capability_id": "C6",
      "source_class": "community_issue_tracker",
      "query": "scheduled summary notification automation blueprint",
      "tool": "repo_search",
      "at": "2026-10-23T14:36:00Z",
      "results_count": 12
    },
    {
      "capability_id": "C6",
      "source_class": "adjacent_domain",
      "query": "scheduled report generator self-hosted",
      "tool": "web_search",
      "at": "2026-10-23T14:40:00Z",
      "results_count": 10
    },
    {
      "capability_id": "C6",
      "source_class": "internal_prior",
      "query": "monthly report",
      "tool": "memory",
      "at": "2026-10-23T14:30:00Z",
      "results_count": 0
    },
    {
      "capability_id": "C3",
      "source_class": "commercial_cots",
      "query": "AirGradient open-source air quality monitor indoor",
      "tool": "web_search",
      "at": "2026-10-23T14:21:16Z",
      "results_count": 4,
      "kept": [
        "cand-airgradient"
      ]
    },
    {
      "capability_id": "C2",
      "source_class": "physical_supplier",
      "query": "SCD41 CO2 sensor module Sensirion datasheet",
      "tool": "web_search",
      "at": "2026-10-23T14:21:16Z",
      "results_count": 4,
      "kept": [
        "cand-scd41"
      ]
    },
    {
      "capability_id": "C4",
      "source_class": "open_source",
      "query": "Home Assistant air quality dashboard Grafana history",
      "tool": "web_search",
      "at": "2026-10-23T14:21:16Z",
      "results_count": 4,
      "kept": [
        "cand-grafana"
      ]
    },
    {
      "capability_id": "C4",
      "source_class": "commercial_cots",
      "query": "Airthings Wave Plus Home Assistant integration local",
      "tool": "web_search",
      "at": "2026-10-23T14:21:16Z",
      "results_count": 4,
      "kept": [
        "cand-airthings"
      ]
    },
    {
      "capability_id": "C5",
      "source_class": "open_source",
      "query": "3D printed enclosure SCD41 CO2 sensor filter",
      "tool": "web_search",
      "at": "2026-10-23T14:21:16Z",
      "results_count": 4,
      "kept": [
        "cand-cyd-scd41",
        "cand-printables-scd41"
      ]
    },
    {
      "capability_id": "C5",
      "source_class": "open_source",
      "query": "Sensor.Community indoor air quality kit",
      "tool": "web_search",
      "at": "2026-10-23T14:21:16Z",
      "results_count": 4,
      "kept": [
        "cand-sensor-community"
      ]
    }
  ],
  "candidates": [
    {
      "id": "cand-ha",
      "name": "Home Assistant (open-source home automation platform)",